{
  "schemaVersion": 1,
  "catalogRevision": "2026-07-23.574961e8",
  "learnerLanguage": "es",
  "targetLanguage": "ja",
  "strategy": "native-first",
  "readiness": "blocked",
  "blockers": [
    "dictionary-objects-not-yet-mirrored"
  ],
  "dictionaries": [
    {
      "dictionaryId": "jmdict-es",
      "role": "primary-terms",
      "priority": 10,
      "selectedByDefault": true,
      "definitionLanguage": "es",
      "translationMode": "off"
    },
    {
      "dictionaryId": "jmnedict",
      "role": "names",
      "priority": 20,
      "selectedByDefault": true,
      "definitionLanguage": "en",
      "translationMode": "offer"
    },
    {
      "dictionaryId": "kanjidic-es",
      "role": "kanji",
      "priority": 30,
      "selectedByDefault": true,
      "definitionLanguage": "es",
      "translationMode": "off"
    }
  ]
}
